{
  "$schema": "https://json-schema.org/draft/2020-12/schema",
  "$id": "https://rae.local/contracts/workflows/workflow-v2.schema.json",
  "title": "RAE graph-native workflow",
  "type": "object",
  "additionalProperties": false,
  "required": ["schema_version", "workflow_id", "revision", "entry_node", "terminal_node", "nodes", "edges"],
  "properties": {
    "schema_version": { "const": "2.0.0" },
    "workflow_id": { "type": "string", "pattern": "^[a-z][a-z0-9-]{2,63}$" },
    "revision": { "type": "integer", "minimum": 1 },
    "title": { "type": "string", "minLength": 1, "maxLength": 160 },
    "entry_node": { "$ref": "#/$defs/nodeId" },
    "terminal_node": { "$ref": "#/$defs/nodeId" },
    "nodes": {
      "type": "array", "minItems": 2, "maxItems": 64,
      "items": { "$ref": "#/$defs/node" }
    },
    "edges": {
      "type": "array", "minItems": 1, "maxItems": 256,
      "items": { "$ref": "#/$defs/edge" }
    },
    "payload_contracts": {
      "type": "object", "maxProperties": 64,
      "additionalProperties": { "type": "object" }
    },
    "budgets": {
      "type": "object", "additionalProperties": false,
      "properties": {
        "max_concurrency": { "type": "integer", "minimum": 1, "maximum": 4 },
        "max_repair_rounds": { "type": "integer", "minimum": 0, "maximum": 5 },
        "max_attempts_per_node": { "type": "integer", "minimum": 1, "maximum": 3 },
        "max_wall_clock_seconds": { "type": "integer", "minimum": 60 },
        "max_provider_attempts": { "type": "integer", "minimum": 1 }
      }
    }
  },
  "$defs": {
    "nodeId": { "type": "string", "pattern": "^[a-z][a-z0-9._-]{0,63}$" },
    "node": {
      "type": "object", "additionalProperties": false,
      "required": ["id", "kind", "access", "guidance"],
      "properties": {
        "id": { "$ref": "#/$defs/nodeId" },
        "kind": { "enum": ["agent", "join", "gate", "checkpoint", "loop", "terminal"] },
        "access": { "enum": ["read", "write", "control"] },
        "guidance": { "type": "string", "minLength": 1, "maxLength": 12000 },
        "role": { "type": "string", "maxLength": 128 },
        "payload_contract": { "type": "string", "pattern": "^[A-Za-z][A-Za-z0-9._-]{0,63}$" },
        "join": { "enum": ["all", "any"] },
        "resource": { "type": "string", "maxLength": 128 },
        "ownership_plan": { "type": "boolean" },
        "mutation_checkpoint": { "type": "boolean" },
        "verification": { "type": "boolean" },
        "loop": {
          "type": "object", "additionalProperties": false,
          "required": ["max_iterations", "members"],
          "properties": {
            "max_iterations": { "type": "integer", "minimum": 1, "maximum": 5 },
            "members": { "type": "array", "minItems": 1, "maxItems": 32, "uniqueItems": true, "items": { "$ref": "#/$defs/nodeId" } }
          }
        }
      }
    },
    "edge": {
      "type": "object", "additionalProperties": false,
      "required": ["from", "to", "type"],
      "properties": {
        "from": { "$ref": "#/$defs/nodeId" },
        "to": { "$ref": "#/$defs/nodeId" },
        "type": { "enum": ["sequence", "artifact", "condition", "loop-back", "context"] },
        "artifact": { "type": "string", "maxLength": 128 },
        "condition": { "enum": ["success", "failure", "blocking-findings", "budget-available"] }
      }
    }
  }
}
